{
  "provider_id": "sso_provider_org_123",
  "organization_id": "org_123",
  "name": "Smoke SAML",
  "kind": "saml",
  "issuer": "https://idp.example.test/metadata",
  "sso_url": "https://idp.example.test/sso",
  "certificate_secret_ref": {
    "secret_id": "secret_sso_provider_org_123_cert",
    "provider": "local-dev",
    "external_ref": "local-dev/sso/org_123/saml-cert"
  },
  "claim_mappings": [
    {
      "claim": "email",
      "field": "email"
    },
    {
      "claim": "groups",
      "field": "groups"
    }
  ],
  "status": "active"
}
